{
  "protocol": "meerkateer-agent",
  "protocol_version": "1",
  "agent_id": "00000000-0000-4000-8000-000000000002",
  "credential": "fixture-agent-credential-0000000000000001",
  "credential_expires_at": "2026-12-27T00:00:00Z",
  "config_signing_key_id": "fixture-key-1",
  "config_signing_public_key": "AAAAAAAAAAAAAAAAAAAAAAAAAAAAAAAAAAAAAAAAAAA=",
  "configuration_revision": 0,
  "heartbeat_interval_seconds": 60,
  "max_batch_bytes": 262144,
  "server_time": "2026-09-27T00:00:00Z"
}
